{
  "$schema": "https://json-schema.org/draft/2020-12/schema",
  "$id": "https://github.com/special-place-ai-heaven/aap-runner/blob/main/parity/contracts/vm-cap-notes.schema.json",
  "title": "The deadline record a managed VM carries in its own Hyper-V Notes (allocator.md, Host power-off backstop)",
  "x-contract-version": 1,
  "x-owner": "P10.6 (Windows provider) and P11.3 (Linux provider) write it before the VM's first start; P10.7 (host watchdog) reads it; consumers P12.3, P02.1",
  "type": "object",
  "additionalProperties": false,
  "required": [
    "schema",
    "kind",
    "vm_id",
    "vm_name",
    "reservation_id",
    "started_utc",
    "deadline_utc",
    "check"
  ],
  "description": "One compact ASCII JSON object in the VM's Notes, under 1 KiB, no secret and no path. deadline_utc is started_utc plus the 6 hour ceiling exactly, never the configured cap. check is the first 32 hex of the SHA-256 of 'aap-vm-cap:1|' and vm_id, vm_name, reservation_id, started_utc and deadline_utc joined by '|' (validate.py notes_check): it detects truncation and hand edits and is no secret. The watchdog acts only when every identity rule of allocator.md B3 holds.",
  "$defs": {
    "time": {
      "type": "string",
      "pattern": "^[0-9]{4}-[0-9]{2}-[0-9]{2}T[0-9]{2}:[0-9]{2}:[0-9]{2}Z$"
    }
  },
  "properties": {
    "schema": {
      "const": 1
    },
    "kind": {
      "const": "aap-vm-cap"
    },
    "vm_id": {
      "type": "string",
      "pattern": "^[0-9a-f]{8}-[0-9a-f]{4}-[0-9a-f]{4}-[0-9a-f]{4}-[0-9a-f]{12}$"
    },
    "vm_name": {
      "type": "string",
      "pattern": "^aap-(w|l)-[1-5]-[0-9]{1,9}-[0-9a-f]{8}$"
    },
    "reservation_id": {
      "type": "string",
      "pattern": "^r-[0-9a-f]{16}$"
    },
    "started_utc": {
      "$ref": "#/$defs/time"
    },
    "deadline_utc": {
      "$ref": "#/$defs/time"
    },
    "check": {
      "type": "string",
      "pattern": "^[0-9a-f]{32}$"
    }
  }
}
